"Bidhannagar, Kolkata, India",85,85.0,56.0,24.8,8.4,7.0,4.7,22.58157048,88.41002457,2024-05-03 09:00:00
"Sidhu Kanhu Indoor Stadium, Durgapur, India",217,197.0,217.0,36.1,9.0,21.6,13.7,23.5404352,87.2892225,2024-05-03 09:00:00
"Victoria, Kolkata, India",79,79.0,66.0,12.2,5.3,3.5,8.3,22.5448082,88.3403691,2024-05-03 09:00:00
"Rabindra Bharati University, Kolkata, India",62,60.0,62.0,35.8,8.5,3.7,5.4,22.627847,88.380669,2024-05-03 09:00:00
"Kolkata US Consulate, India (कोलकाता अमेरिकी वाणिज्य दूतावास)",127,127.0,,,,,,22.562629699707,88.363037109375,2024-05-03 09:00:00
"Rabindra Bharati University, Kolkata, India",62,60.0,62.0,35.8,8.5,3.7,5.4,22.627847,88.380669,2024-05-03 09:00:00
"Ward-32 Bapupara, Siliguri, India",155,155.0,107.0,20.1,17.0,5.9,4.0,26.6883049,88.412668,2024-05-03 09:00:00
"Gulzarpet, Anantapur, India",76,76.0,52.0,19.0,5.1,2.9,9.2,14.675886,77.593027,2024-04-30 18:00:00
"Anand Kala Kshetram, Rajamahendravaram, India",23,9.0,23.0,5.3,2.1,4.8,5.5,16.9872867,81.7363176,2024-04-30 18:00:00
"Tirumala-APPCB, Tirupati, India",70,70.0,50.0,16.8,10.6,5.6,7.0,13.67,79.35,2024-04-30 18:00:00
"PWD Grounds, Vijayawada, India",-,52.0,,5.1,0.7,4.9,4.2,16.507014,80.627767,2020-11-19 16:00:00
"Naharlagun, Naharlagun, India",82,82.0,37.0,1.0,1.1,1.7,2.6,27.103358,93.679645,2024-04-30 18:00:00
"Pan Bazaar, Guwahati, India",140,79.0,140.0,7.1,0.4,24.0,4.5,26.1875,91.744194,2024-04-30 18:00:00
"D M Colony, Bihar Sharif, India",98,98.0,65.0,12.2,3.5,0.2,9.9,25.204762,85.51496,2024-04-30 18:00:00
"New DM Office, Arrah, India",147,147.0,116.0,19.8,0.5,8.6,2.2,25.5626095,84.663264,2024-04-30 18:00:00
"DRCC Anandpur, Begusarai, India",262,262.0,152.0,1.6,34.0,6.8,2.1,25.444266,86.140169,2023-12-22 18:00:00
"Kamalnath Nagar, Bettiah, India",167,167.0,105.0,7.6,10.4,4.5,11.4,26.80365,84.51954,2024-04-30 17:00:00
"DM Office_Kachari Chowk, Bhagalpur, India",109,109.0,52.0,19.2,27.8,6.4,10.6,25.251013,86.989001,2024-04-30 18:00:00
"D M Colony, Bihar Sharif, India",98,98.0,65.0,12.2,3.5,0.2,9.9,25.204762,85.51496,2024-04-30 18:00:00
"SFTI Kusdihra, Gaya, India",66,66.0,62.0,19.1,6.8,4.1,4.1,24.762518,84.982348,2024-04-30 18:00:00
"Central Jail, Buxar, India",241,241.0,147.0,8.2,1.6,1.5,6.0,25.555605,83.950942,2022-12-01 17:00:00
"Darshan Nagar, Chhapra, India",165,165.0,115.0,0.8,11.6,5.7,11.0,25.7808257,84.7446768,2024-04-30 18:00:00
"Town Hall - Lal Bagh, Darbhanga, India",192,192.0,170.0,21.6,1.6,10.1,4.8,26.15146,85.89342,2023-01-14 13:00:00
"Collectorate, Gaya, India",97,97.0,,20.8,1.2,3.4,8.5,24.7955,84.9994,2024-04-30 18:00:00
"Industrial Area, Hajipur, India",178,117.0,178.0,11.5,18.5,3.6,4.5,25.697189,85.2459,2024-04-30 18:00:00
"Town Hall, Munger, India",161,161.0,98.0,53.0,2.2,13.1,8.8,25.376776,86.471523,2024-04-30 13:00:00
"Mirchaibari, Katihar, India",118,72.0,118.0,5.9,9.3,9.4,11.7,25.560083,87.553265,2024-04-30 18:00:00
"Gandak Colony, Motihari, India",159,159.0,80.0,58.2,26.1,4.7,4.9,26.63086,84.90051,2024-04-30 18:00:00
"Town Hall, Munger, India",161,161.0,98.0,53.0,2.2,13.1,8.8,25.376776,86.471523,2024-04-30 13:00:00
"Buddha Colony, Muzaffarpur, India",205,205.0,183.0,11.7,14.0,2.6,4.0,26.11442,85.39813,2024-04-30 18:00:00
"IGSC Planetarium Complex, Patna, India",124,124.0,,16.9,4.1,2.0,2.2,25.6103665,85.1327137,2024-04-30 18:00:00
"Police Line, Saharsa, India",270,270.0,89.0,12.5,2.6,6.8,10.1,25.892357,86.590325,2024-04-30 18:00:00
"DM Office_Kasipur, Samastipur, India",132,132.0,87.0,14.6,3.6,31.6,30.8,25.859655,85.77944,2024-04-30 18:00:00
"Chitragupta Nagar, Siwan, India",51,63.0,94.0,50.9,9.1,12.9,40.4,26.2271665,84.3570427,2024-04-30 18:00:00
"Sector 22, Chandigarh, India",81,81.0,71.0,64.2,7.2,3.7,6.5,30.735567,76.775714,2024-04-30 18:00:00
"Sector 22, Chandigarh, India",81,81.0,71.0,64.2,7.2,3.7,6.5,30.735567,76.775714,2024-04-30 18:00:00
"Civic Center, Bhilai, India",75,75.0,36.0,31.5,5.2,3.2,9.4,21.185571,81.343175,2024-04-30 18:00:00
"Mangala, Bilaspur, India",88,88.0,59.0,,4.7,6.2,8.2,22.08815,82.13737,2024-04-30 18:00:00
"Civic Center, Bhilai, India",75,75.0,36.0,31.5,5.2,3.2,9.4,21.185571,81.343175,2024-04-30 18:00:00
"Doon University, Dehradun, India",109,106.0,109.0,53.6,0.5,1.3,2.8,30.269444,78.044167,2024-04-30 18:00:00
"Phase-1 GIDC, Vapi, India",85,85.0,69.0,0.4,2.4,21.8,,20.362421,72.918013,2024-04-30 18:00:00
"Phase-1 GIDC, Vapi, India",85,85.0,69.0,0.4,2.4,21.8,,20.362421,72.918013,2024-04-30 18:00:00
"New Delhi US Embassy, India (नई दिल्ली अमेरिकी दूतावास)",95,95.0,,,,,,28.63576,77.22445,2024-04-30 17:00:00
"New Delhi US Embassy, India (नई दिल्ली अमेरिकी दूतावास)",95,95.0,,,,,,28.63576,77.22445,2024-04-30 17:00:00
"New Delhi US Embassy, India (नई दिल्ली अमेरिकी दूतावास)",95,95.0,,,,,,28.63576,77.22445,2024-04-30 17:00:00
"Maninagar, Ahmedabad, India",77,77.0,77.0,11.3,11.1,21.1,15.5,23.002657,72.591912,2024-04-30 18:00:00
"GIDC, Ankleshwar, India",82,82.0,65.0,10.4,11.8,14.0,6.5,21.613267,73.010555,2024-04-30 18:00:00
"GIFT City, Gandhinagar, India",11,,,11.4,1.4,2.9,9.4,23.163798,72.677768,2024-04-30 18:00:00
"13 Lenin street, Oha, Russia (ул.Ленина, д.13)",10,10.0,4.0,5.2,0.7,,4.3,53.58904,142.94797,2022-01-12 05:00:00
"Patti Mehar, Ambala, India",104,104.0,26.0,13.6,1.5,11.4,7.7,30.379589,76.778328,2024-04-30 18:00:00
"H.B. Colony, Bhiwani, India",129,129.0,81.0,3.7,2.8,3.7,12.2,28.806223,76.141105,2024-04-30 18:00:00
"Sector 22, Chandigarh, India",81,81.0,71.0,64.2,7.2,3.7,6.5,30.735567,76.775714,2024-04-30 18:00:00
"Sector16A Faridabad, Faridabad, India",61,61.0,,5.7,4.6,9.9,2.0,28.4088421,77.3099081,2024-04-30 18:00:00
"Urban Estate-II, Hisar, India",97,97.0,95.0,63.8,9.2,20.3,3.7,29.14056,75.744941,2024-04-30 18:00:00
"Police Lines, Jind, India",84,84.0,70.0,7.3,5.6,3.1,1.7,29.307814,76.337619,2024-04-30 18:00:00
"Rishi Nagar, Kaithal, India",104,58.0,104.0,4.7,9.4,41.4,1.9,29.8006,76.4155,2024-04-30 18:00:00
"Sector-12, Karnal, India",159,159.0,72.0,13.2,4.3,5.0,4.0,29.6953,77.0027,2024-04-30 18:00:00
"MD University, Rohtak, Rohtak, India",223,223.0,,11.2,7.1,2.8,9.9,28.870083,76.6205,2020-01-13 04:00:00
"F-Block, Sirsa, India",105,105.0,72.0,37.9,3.7,3.8,9.9,29.5364,75.0158,2024-04-30 18:00:00
"Murthal, Sonipat, India",64,58.0,64.0,14.3,13.8,11.7,1.6,29.0272,77.0621,2024-04-30 18:00:00
"Mangala, Bilaspur, India",88,88.0,59.0,,4.7,6.2,8.2,22.08815,82.13737,2024-04-30 18:00:00
"Unna-Königsborn, Germany",40,40.0,,39.5,3.8,,,51.547479,7.693785,2024-04-30 13:00:00
"Rajbagh, Srinagar, India",58,58.0,41.0,5.6,4.6,4.8,4.0,34.066206,74.81982,2024-03-04 09:00:00
"Tata Stadium, Jorapokhar, India",14,,,14.1,6.1,14.0,4.7,23.707909,86.41467,2024-04-30 18:00:00
"Hombegowda Nagar, Bengaluru, India",72,72.0,51.0,10.8,6.0,1.8,5.1,12.938539,77.5901,2024-04-30 18:00:00
"Ramteerth Nagar, Belgaum, India",72,64.0,72.0,8.0,12.1,3.5,6.8,15.888653,74.541751,2024-04-30 18:00:00
"Kalyana Nagara, Chikkamagaluru, India",110,110.0,44.0,16.5,8.4,3.7,15.4,13.328028,75.797056,2024-04-30 18:00:00
"Devaraj Urs Badavane, Davanagere, India",58,78.0,58.0,,,,,14.4758,75.9052,2024-04-30 18:00:00
"B.Katihalli, Hassan, India",76,76.0,51.0,1.5,1.1,10.2,3.2,13.008556,76.125258,2024-04-30 18:00:00
"Lal Bahadur Shastri Nagar, Kalaburagi, India",82,82.0,50.0,12.2,4.5,9.5,9.4,17.321993,76.822628,2024-04-30 18:00:00
"Tamaka Ind. Area, Kolar, India",65,65.0,46.0,6.3,7.5,6.7,1.1,13.1276288,78.1570122,2024-04-30 18:00:00
"Stuart Hill, Madikeri, India",93,93.0,51.0,12.2,8.5,1.6,1.3,12.415911,75.73505,2024-04-30 18:00:00
"Kadri, Mangalore, India",119,119.0,60.0,13.1,2.1,6.4,6.7,12.88925,74.853,2024-04-30 18:00:00
"Haji Colony, Raichur, India",61,61.0,59.0,1.9,17.9,41.3,20.6,16.208139,77.348417,2024-04-30 13:00:00
"Vinoba Nagara, Shivamogga, India",86,86.0,56.0,31.8,7.6,3.1,7.2,13.94,75.555917,2024-04-30 18:00:00
"Ibrahimpur, Vijayapura, India",64,64.0,39.0,6.3,6.9,216.6,10.9,16.802639,75.722694,2024-04-30 18:00:00
"Thavakkara, Kannur, India",120,120.0,54.0,12.8,2.6,0.2,5.8,11.875,75.3732,2024-04-30 18:00:00
"Kera, Kochi, Kochi Prefecture, Japan (介良高知市)",34,34.0,12.0,12.8,2.8,1.5,,33.5489621,133.5987948,2024-04-30 21:00:00
"Polayathode, Kollam, India",134,134.0,59.0,14.3,3.1,1.2,2.8,8.8787,76.6073,2024-04-30 18:00:00
"Plammoodu, Thiruvananthapuram, India",34,34.0,20.0,2.8,3.4,3.0,2.9,8.5149093,76.9435879,2024-04-30 18:00:00
"Corporation Ground, Thrissur, India",85,85.0,55.0,12.0,2.8,0.3,3.5,10.5324,76.2159,2024-04-30 18:00:00
"Centre, Bvd François 1er, Le Havre, France",22,,10.0,22.0,,1.1,,49.4896322869577,0.100702489901362,2024-04-30 15:00:00
"T T Nagar, Bhopal, India",105,61.0,105.0,32.3,8.6,8.1,3.5,23.233584,77.400574,2024-04-30 18:00:00
"Shrivastav Colony, Damoh, India",50,50.0,36.0,,2.4,,4.4,23.81748678,79.446246,2024-01-22 16:00:00
"Bhopal Chauraha, Dewas, India",63,63.0,36.0,17.9,4.6,10.7,3.3,22.9682591,76.064118,2024-04-30 18:00:00
"Phool Bagh, Gwalior, India",176,176.0,101.0,,1.9,11.5,15.4,26.210536,78.171,2024-04-30 18:00:00
"Marhatal, Jabalpur, India",68,68.0,66.0,30.5,20.5,4.0,11.6,23.168606,79.932247,2024-04-30 18:00:00
"Shasthri Nagar, Ratlam, India",114,114.0,96.0,,10.2,15.0,,23.331731,75.045981,2024-04-30 18:00:00
"Deen Dayal Nagar, Sagar, India",74,74.0,9.0,,8.6,4.9,9.2,23.8640158,78.80289321,2024-04-30 18:00:00
"Bandhavgar Colony, Satna, India",63,52.0,63.0,15.8,18.2,1.8,6.6,24.58434363,80.8549414,2024-04-30 18:00:00
"Mahakaleshwar Temple, Ujjain, India",72,61.0,72.0,57.1,41.2,1.9,2.2,23.182719,75.768218,2024-04-30 18:00:00
"Gurdeo Nagar, Aurangabad, India",24,101.0,82.0,23.5,3.8,0.8,1.4,24.75746,84.366208,2024-04-30 18:00:00
"MIDC Khutala, Chandrapur, India",174,143.0,174.0,0.6,17.3,9.2,13.0,19.9775302,79.2337086,2024-04-25 22:00:00
"Malayer, Hamadan, Iran (ملایر همدان)",59,58.0,59.0,,34.0,6.0,7.0,34.2875011,48.787992,2024-04-30 17:00:00
"Khadakpada, Kalyan, India",131,79.0,131.0,8.0,11.8,11.4,3.3,19.25292,73.142019,2024-04-30 18:00:00
"Mumbai US Consulate, India (मुंबई अमेरिकी वाणिज्य दूतावास)",109,109.0,,,,,,19.072830200195,72.882606506348,2024-04-29 15:00:00
"Opp GPO Civil Lines, Nagpur, India",97,97.0,52.0,16.6,5.9,4.0,8.8,21.152875,79.0517531,2024-04-30 18:00:00
"Gangapur Road, Nashik, India",118,118.0,66.0,24.0,7.3,5.8,5.7,20.0073285,73.7762427,2024-04-30 18:00:00
"Shivajinagar, Pune, Pune, India",232,232.0,138.0,61.0,198.0,,51.0,18.529603,73.849586,2021-11-15 06:00:00
"Solapur, Solapur, India",103,103.0,88.0,,19.7,47.4,,17.6599188,75.9063906,2024-04-30 18:00:00
"Pimpleshwar Mandir, Dombivali, Thane, India",103,,103.0,23.5,11.7,58.5,8.7,19.192056,72.9585188,2024-04-30 13:00:00
"Khadakpada, Kalyan, India",131,79.0,131.0,8.0,11.8,11.4,3.3,19.25292,73.142019,2024-04-30 18:00:00
"DM College of Science, Imphal, India",66,66.0,49.0,8.5,2.6,43.2,1.3,24.8207389,93.9423085,2024-04-30 18:00:00
"Lumpyngngad, Shillong, India",147,147.0,54.0,16.3,0.8,17.2,1.9,25.5586,91.8985,2024-04-30 18:00:00
"Sikulpuikawn, Aizawl, India",75,66.0,75.0,0.1,0.6,1.1,3.2,23.7176342,92.7192841,2024-04-30 18:00:00
"PWD Juction, Kohima, India",165,165.0,85.0,5.5,1.3,13.7,3.5,25.6635413,94.0989878,2024-04-30 18:00:00
"Mons, Belgium",13,12.0,13.0,,,,,50.4651921586212,3.93971432591091,2024-04-30 15:00:00
"Jawahar Nagar, Puducherry, India",16,30.0,16.0,1.9,0.7,1.7,4.3,11.9309,79.8027,2024-04-30 18:00:00
"Jawahar Nagar, Puducherry, India",16,30.0,16.0,1.9,0.7,1.7,4.3,11.9309,79.8027,2024-04-30 18:00:00
"Golden Temple, Amritsar, India",-,41.0,15.0,14.2,37.1,7.1,5.7,31.62,74.876512,2024-04-30 18:00:00
"Sector 22, Chandigarh, India",81,81.0,71.0,64.2,7.2,3.7,6.5,30.735567,76.775714,2024-04-30 18:00:00
"Civil Line, Jalandhar, India",103,103.0,71.0,18.6,14.6,3.4,3.5,31.321907,75.578914,2024-04-30 18:00:00
"Punjab Agricultural University, Ludhiana, India",115,115.0,60.0,15.6,4.8,2.9,4.3,30.9028,75.8086,2024-04-30 18:00:00
"Model Town, Patiala, India",97,97.0,72.0,24.1,8.8,2.0,3.7,30.349388,76.366642,2024-04-30 18:00:00
"Ratanpura, Rupnagar, India",108,108.0,56.0,,,5.3,7.7,31.0325454,76.5623046,2024-04-30 18:00:00
"Civil Lines, Ajmer, India",56,56.0,44.0,32.6,4.6,5.4,13.2,26.470859,74.646594,2024-04-30 18:00:00
"Moti Doongri, Alwar, India",118,118.0,59.0,18.9,10.3,7.5,5.4,27.554793,76.611536,2024-04-30 18:00:00
"Tulle centre, France",23,,15.0,22.8,3.2,,,45.262666665757,1.76283333333,2024-04-30 15:00:00
"Police Commissionerate, Jaipur, India",153,153.0,81.0,34.0,8.5,6.5,5.6,26.9164092,75.7994901,2024-04-30 18:00:00
"Collectorate, Jodhpur, India",135,135.0,54.0,46.6,1.3,2.8,13.0,26.268249,73.0193853,2024-04-30 18:00:00
"Shrinath Puram, Kota, India",131,131.0,94.0,28.9,5.0,4.4,13.7,25.14389,75.821256,2024-04-30 18:00:00
"Indira Colony Vistar, Pali, India",153,153.0,106.0,25.8,0.6,3.8,7.5,25.771061,73.340227,2024-04-30 18:00:00
"Ashok Nagar, Udaipur, India",113,113.0,74.0,25.9,19.5,2.6,8.1,24.5886166,73.6321397,2024-04-30 18:00:00
"Zero Point GICI, Gangtok, India",67,67.0,59.0,27.5,1.5,5.1,3.4,27.33853,88.614099,2024-04-30 18:00:00
"Chennai US Consulate, Chennai, India (चेन्नई अमेरिकी वाणिज्य दूतावास)",25,25.0,,,,,,13.087840080261,80.278472900391,2024-04-30 18:00:00
"SIDCO Kurichi, Coimbatore, India",87,87.0,58.0,3.2,0.5,7.2,5.2,10.942451,76.978996,2023-07-21 11:00:00
"Mendonsa Colony, Dindigul, India",61,61.0,41.0,1.0,0.1,17.0,4.2,10.358535,77.984321,2023-07-25 10:00:00
"Chalai Bazaar, Ramanathapuram, India",25,25.0,20.0,5.5,,3.1,0.5,9.36399,78.831977,2024-04-30 18:00:00
"Salem, Oregon, USA",11,11.0,,23.9,,,,44.943114,-123.005934,2024-04-30 05:00:00
"Kumaran College, Tirupur, India",56,56.0,55.0,2.7,4.7,9.9,8.2,11.0973603,77.3228673,2024-04-30 10:00:00
"Meelavittan, Thoothukudi, India",43,,43.0,29.7,10.5,7.9,13.1,8.816428,78.099039,2024-04-30 18:00:00
"Bombay Castel, Ooty, India",70,70.0,48.0,2.3,6.3,5.4,4.1,11.4068288,76.7138973,2024-04-30 18:00:00
"Hyderabad US Consulate, India (हैदराबाद अमेरिकी वाणिज्य दूतावास)",104,104.0,,,,,,17.384050369263,78.456359863281,2024-04-30 18:00:00
"IITH Kandi, Hyderabad, India",58,58.0,56.0,16.2,3.1,4.3,4.2,17.585705,78.126199,2024-04-30 14:00:00
"Bardowali, Agartala, India",128,128.0,86.0,10.5,2.4,12.7,2.9,23.8175497,91.2726974,2024-04-30 18:00:00
"Sanjay Palace, Agra, India",25,13.0,25.0,8.4,8.4,,,27.19865833,78.00598056,2024-04-30 18:00:00
"Rajendra Nagar, Bareilly, India",65,52.0,65.0,3.8,0.9,18.5,0.5,28.38910936,79.42963708,2024-04-30 18:00:00
"Yamunapuram, Bulandshahr, India",112,91.0,112.0,45.0,10.8,7.7,5.0,28.406963,77.849831,2024-04-30 18:00:00
"Sanjay Nagar, Ghaziabad, India",110,78.0,110.0,67.3,9.9,5.3,6.7,28.685382,77.453839,2024-04-30 18:00:00
"Madan Mohan Malaviya University of Technology, Gorakhpur, India",125,125.0,110.0,27.4,4.1,15.4,1.8,26.730136,83.433859,2024-04-30 18:00:00
"Shivaji Nagar, Jhansi, India",68,68.0,32.0,16.5,1.8,6.0,1.1,25.4547,78.6039,2024-04-30 18:00:00
"FTI Kidwai Nagar, Kanpur, India",114,114.0,94.0,4.7,6.5,10.3,5.1,26.428282,80.327067,2024-04-30 18:00:00
"B R Ambedkar University, Lucknow, India",100,100.0,98.0,31.9,4.0,14.1,3.8,26.766433,80.927299,2024-04-30 18:00:00
"Omex Eternity, Vrindavan, India",51,51.0,48.0,12.4,0.8,17.2,3.9,27.571409,77.655757,2024-04-30 18:00:00
"Pallavpuram Phase 2, Meerut, India",110,70.0,110.0,30.7,11.5,9.8,3.7,29.06351,77.709723,2024-04-30 18:00:00
"Jigar Colony, Moradabad, India",86,77.0,86.0,28.5,6.6,3.7,5.4,28.856664,78.772638,2024-04-30 18:00:00
"New Mandi, Muzaffarnagar, India",134,112.0,134.0,38.2,6.6,5.7,5.4,29.4723508,77.7194031,2024-04-30 18:00:00
"Maldahiya, Varanasi, India",72,72.0,41.0,9.3,0.7,10.9,0.1,25.32393,82.99687,2024-04-30 18:00:00
"Doon University, Dehradun, India",109,106.0,109.0,53.6,0.5,1.3,2.8,30.269444,78.044167,2024-04-30 18:00:00
"Flag Pole, Woodstock School, Mussoorie, India, India",-,,,,,,,30.455449,78.100618,
"Asansol Court Area, Asansol, India",173,173.0,92.0,18.3,13.0,2.4,5.7,23.685297,86.945968,2024-04-30 18:00:00
"Ghusuri, Howrah, India",173,173.0,140.0,9.1,6.0,2.0,5.7,22.611968,88.347422,2024-04-30 18:00:00
"Rabindra Bharati University, Kolkata, India",83,83.0,78.0,25.0,12.8,4.2,6.8,22.627847,88.380669,2024-04-30 18:00:00
"Bidhannagar, Kolkata, India",159,159.0,83.0,31.0,8.7,5.4,7.0,22.58157048,88.41002457,2024-04-30 18:00:00
"Sidhu Kanhu Indoor Stadium, Durgapur, India",158,158.0,80.0,34.0,6.5,4.9,4.7,23.5404352,87.2892225,2024-04-30 18:00:00
"Victoria, Kolkata, India",153,153.0,84.0,26.2,8.1,12.8,11.1,22.5448082,88.3403691,2024-04-30 18:00:00
"Rabindra Bharati University, Kolkata, India",83,83.0,78.0,25.0,12.8,4.2,6.8,22.627847,88.380669,2024-04-30 18:00:00
"Kolkata US Consulate, India (कोलकाता अमेरिकी वाणिज्य दूतावास)",161,161.0,,,,,,22.562629699707,88.363037109375,2024-04-30 18:00:00
"Rabindra Bharati University, Kolkata, India",83,83.0,78.0,25.0,12.8,4.2,6.8,22.627847,88.380669,2024-04-30 18:00:00
"Ward-32 Bapupara, Siliguri, India",92,92.0,74.0,21.5,17.0,2.9,6.6,26.6883049,88.412668,2024-04-30 18:00:00
"Gulzarpet, Anantapur, India",76,76.0,70.0,17.4,9.9,5.8,13.1,14.675886,77.593027,2024-04-21 20:00:00
"Anand Kala Kshetram, Rajamahendravaram, India",55,55.0,32.0,7.2,3.0,4.8,5.5,16.9872867,81.7363176,2024-04-21 20:00:00
"Tirumala-APPCB, Tirupati, India",119,119.0,60.0,12.3,11.8,3.2,9.4,13.67,79.35,2024-04-21 20:00:00
"PWD Grounds, Vijayawada, India",-,52.0,,5.1,0.7,4.9,4.2,16.507014,80.627767,2020-11-19 16:00:00
"Naharlagun, Naharlagun, India",77,77.0,37.0,1.0,1.1,1.6,2.6,27.103358,93.679645,2024-04-17 15:00:00
"Pan Bazaar, Guwahati, India",41,41.0,26.0,7.1,0.2,15.9,4.3,26.1875,91.744194,2024-04-18 07:00:00
"D M Colony, Bihar Sharif, India",108,108.0,69.0,11.5,3.4,1.8,10.1,25.204762,85.51496,2024-04-21 20:00:00
"New DM Office, Arrah, India",105,105.0,77.0,6.1,6.2,6.2,2.9,25.5626095,84.663264,2024-04-19 07:00:00
"DRCC Anandpur, Begusarai, India",262,262.0,152.0,1.6,34.0,6.8,2.1,25.444266,86.140169,2023-12-22 18:00:00
"Kamalnath Nagar, Bettiah, India",165,165.0,101.0,4.5,3.1,6.3,11.5,26.80365,84.51954,2024-04-21 20:00:00
"DM Office_Kachari Chowk, Bhagalpur, India",162,118.0,162.0,18.5,40.5,6.8,11.7,25.251013,86.989001,2024-04-21 20:00:00
"D M Colony, Bihar Sharif, India",108,108.0,69.0,11.5,3.4,1.8,10.1,25.204762,85.51496,2024-04-21 20:00:00
"SFTI Kusdihra, Gaya, India",91,91.0,68.0,14.9,28.0,3.3,5.6,24.762518,84.982348,2024-04-21 20:00:00
"Central Jail, Buxar, India",241,241.0,147.0,8.2,1.6,1.5,6.0,25.555605,83.950942,2022-12-01 17:00:00
"Darshan Nagar, Chhapra, India",154,154.0,91.0,0.4,10.3,1.0,11.5,25.7808257,84.7446768,2024-04-21 20:00:00
"Town Hall - Lal Bagh, Darbhanga, India",192,192.0,170.0,21.6,1.6,10.1,4.8,26.15146,85.89342,2023-01-14 13:00:00
"Collectorate, Gaya, India",97,97.0,,28.5,0.3,6.4,13.8,24.7955,84.9994,2024-04-21 20:00:00
"Industrial Area, Hajipur, India",170,123.0,170.0,18.8,22.0,3.0,4.8,25.697189,85.2459,2024-04-21 20:00:00
"Town Hall, Munger, India",180,180.0,136.0,11.9,3.0,11.6,13.5,25.376776,86.471523,2024-04-21 20:00:00
"Mirchaibari, Katihar, India",139,93.0,139.0,5.0,10.4,8.0,10.0,25.560083,87.553265,2024-04-21 20:00:00
"Gandak Colony, Motihari, India",168,168.0,94.0,44.9,24.2,2.6,6.2,26.63086,84.90051,2024-04-21 20:00:00
"Town Hall, Munger, India",180,180.0,136.0,11.9,3.0,11.6,13.5,25.376776,86.471523,2024-04-21 20:00:00
"Buddha Colony, Muzaffarpur, India",205,205.0,182.0,13.3,23.2,4.0,8.2,26.11442,85.39813,2024-04-21 20:00:00
"IGSC Planetarium Complex, Patna, India",151,151.0,,14.4,4.1,2.0,2.2,25.6103665,85.1327137,2024-04-21 20:00:00
"Police Line, Saharsa, India",118,97.0,118.0,13.5,2.7,6.7,10.0,25.892357,86.590325,2024-04-21 20:00:00
"DM Office_Kasipur, Samastipur, India",-,107.0,82.0,5.1,2.1,3.8,3.8,25.859655,85.77944,2024-04-21 14:00:00
"Chitragupta Nagar, Siwan, India",-,122.0,89.0,21.4,11.0,10.5,32.3,26.2271665,84.3570427,2024-04-20 11:00:00
"Sector 22, Chandigarh, India",57,57.0,44.0,53.4,11.1,4.2,6.2,30.735567,76.775714,2024-04-21 19:00:00
"Sector 22, Chandigarh, India",57,57.0,44.0,53.4,11.1,4.2,6.2,30.735567,76.775714,2024-04-21 19:00:00
"Civic Center, Bhilai, India",65,65.0,51.0,6.6,4.1,4.3,7.7,21.185571,81.343175,2024-04-21 20:00:00
"Mangala, Bilaspur, India",154,154.0,43.0,,7.2,5.8,9.5,22.08815,82.13737,2024-04-21 12:00:00
"Civic Center, Bhilai, India",65,65.0,51.0,6.6,4.1,4.3,7.7,21.185571,81.343175,2024-04-21 20:00:00
"Doon University, Dehradun, India",113,113.0,68.0,37.3,0.9,0.9,3.1,30.269444,78.044167,2024-04-21 20:00:00
"Phase-1 GIDC, Vapi, India",71,71.0,52.0,2.3,2.4,21.4,,20.362421,72.918013,2024-04-21 20:00:00
"Phase-1 GIDC, Vapi, India",71,71.0,52.0,2.3,2.4,21.4,,20.362421,72.918013,2024-04-21 20:00:00
"New Delhi US Embassy, India (नई दिल्ली अमेरिकी दूतावास)",85,85.0,,,,,,28.63576,77.22445,2024-04-21 20:00:00
"New Delhi US Embassy, India (नई दिल्ली अमेरिकी दूतावास)",85,85.0,,,,,,28.63576,77.22445,2024-04-21 20:00:00
"New Delhi US Embassy, India (नई दिल्ली अमेरिकी दूतावास)",85,85.0,,,,,,28.63576,77.22445,2024-04-21 20:00:00
"Maninagar, Ahmedabad, India",105,105.0,9.0,15.2,16.5,28.4,13.5,23.002657,72.591912,2024-04-21 20:00:00
"GIDC, Ankleshwar, India",70,70.0,43.0,11.5,12.0,8.6,8.8,21.613267,73.010555,2024-04-21 20:00:00
"IIPHG Lekawada, Gandhinagar, India",83,83.0,51.0,9.9,12.6,4.2,6.6,23.243639,72.68994,2024-04-21 20:00:00
"13 Lenin street, Oha, Russia (ул.Ленина, д.13)",10,10.0,4.0,5.2,0.7,,4.3,53.58904,142.94797,2022-01-12 05:00:00
"Patti Mehar, Ambala, India",53,49.0,53.0,13.7,1.5,11.3,7.4,30.379589,76.778328,2024-04-21 20:00:00
"H.B. Colony, Bhiwani, India",121,96.0,116.0,7.9,4.2,121.0,3.7,28.806223,76.141105,2024-04-21 20:00:00
"Sector 22, Chandigarh, India",57,57.0,44.0,53.4,11.1,4.2,6.2,30.735567,76.775714,2024-04-21 19:00:00
"Sector16A Faridabad, Faridabad, India",95,95.0,,5.8,9.8,10.6,5.6,28.4088421,77.3099081,2024-04-21 20:00:00
"Urban Estate-II, Hisar, India",62,46.0,62.0,46.3,8.6,1.5,6.3,29.14056,75.744941,2024-04-21 20:00:00
"Police Lines, Jind, India",90,90.0,53.0,7.7,4.3,2.5,3.3,29.307814,76.337619,2024-04-21 20:00:00
"Rishi Nagar, Kaithal, India",115,80.0,115.0,8.0,9.2,53.6,1.2,29.8006,76.4155,2024-04-21 20:00:00
"Sector-12, Karnal, India",96,96.0,58.0,13.6,4.4,5.1,4.0,29.6953,77.0027,2024-04-21 20:00:00
"MD University, Rohtak, Rohtak, India",223,223.0,,11.2,7.1,2.8,9.9,28.870083,76.6205,2020-01-13 04:00:00
"F-Block, Sirsa, India",101,101.0,68.0,27.4,3.5,3.2,11.2,29.5364,75.0158,2024-04-21 20:00:00
"Murthal, Sonipat, India",86,86.0,77.0,6.8,13.7,11.7,2.0,29.0272,77.0621,2024-04-21 20:00:00
"Mangala, Bilaspur, India",154,154.0,43.0,,7.2,5.8,9.5,22.08815,82.13737,2024-04-21 12:00:00
"Unna-Königsborn, Germany",34,27.0,,34.2,1.2,,,51.547479,7.693785,2024-04-21 15:00:00
"Rajbagh, Srinagar, India",58,58.0,41.0,5.6,4.6,4.8,4.0,34.066206,74.81982,2024-03-04 09:00:00
"Tata Stadium, Jorapokhar, India",11,,,8.8,6.1,11.1,4.7,23.707909,86.41467,2024-04-21 10:00:00
"Hombegowda Nagar, Bengaluru, India",3,82.0,56.0,1.9,5.8,1.6,2.5,12.938539,77.5901,2024-04-21 21:00:00
"Ramteerth Nagar, Belgaum, India",47,47.0,47.0,8.0,7.8,3.6,6.1,15.888653,74.541751,2024-04-21 20:00:00
"Kalyana Nagara, Chikkamagaluru, India",120,120.0,57.0,14.8,7.3,0.2,2.0,13.328028,75.797056,2024-04-21 13:00:00
"Devaraj Urs Badavane, Davanagere, India",880,97.0,880.0,8.3,4.5,1.9,3.3,14.4758,75.9052,2024-04-21 20:00:00
"B.Katihalli, Hassan, India",128,128.0,62.0,1.5,7.1,8.6,2.6,13.008556,76.125258,2024-04-21 07:00:00
"Lal Bahadur Shastri Nagar, Kalaburagi, India",186,186.0,130.0,12.4,4.0,6.9,6.7,17.321993,76.822628,2024-04-21 21:00:00
"Tamaka Ind. Area, Kolar, India",85,85.0,61.0,5.5,23.1,5.3,1.0,13.1276288,78.1570122,2024-04-21 07:00:00
"Stuart Hill, Madikeri, India",82,82.0,43.0,17.2,1.7,1.7,1.6,12.415911,75.73505,2024-04-21 21:00:00
"Kadri, Mangalore, India",80,80.0,54.0,12.6,2.3,6.9,6.7,12.88925,74.853,2024-04-21 20:00:00
"Haji Colony, Raichur, India",-,57.0,74.0,6.7,10.5,32.5,18.3,16.208139,77.348417,2024-04-11 23:00:00
"Vinoba Nagara, Shivamogga, India",90,90.0,58.0,34.4,5.1,3.4,2.0,13.94,75.555917,2024-04-21 21:00:00
"Ibrahimpur, Vijayapura, India",63,63.0,39.0,6.2,6.9,3.2,6.2,16.802639,75.722694,2024-04-21 21:00:00
"Thavakkara, Kannur, India",119,119.0,63.0,13.0,2.2,1.2,5.8,11.875,75.3732,2024-04-21 21:00:00
"Kera, Kochi, Kochi Prefecture, Japan (介良高知市)",17,17.0,6.0,12.1,1.9,1.5,,33.5489621,133.5987948,2024-04-21 23:00:00
"Polayathode, Kollam, India",104,104.0,65.0,14.0,3.1,2.3,7.3,8.8787,76.6073,2024-04-21 21:00:00
"Plammoodu, Thiruvananthapuram, India",90,90.0,46.0,8.1,3.4,2.4,2.2,8.5149093,76.9435879,2024-04-21 21:00:00
"Corporation Ground, Thrissur, India",82,82.0,53.0,11.4,2.7,0.3,6.4,10.5324,76.2159,2024-04-21 21:00:00
"Rue  Lafaurie (coté Montant), Le Havre, France",53,53.0,12.0,,3.2,,,49.5001917595947,0.110902803971606,2024-04-21 16:00:00
"T T Nagar, Bhopal, India",118,86.0,118.0,18.2,12.4,9.1,6.5,23.233584,77.400574,2024-04-21 21:00:00
"Shrivastav Colony, Damoh, India",50,50.0,36.0,,2.4,,4.4,23.81748678,79.446246,2024-01-22 16:00:00
"Bhopal Chauraha, Dewas, India",81,81.0,48.0,8.7,4.6,9.6,3.9,22.9682591,76.064118,2024-04-21 08:00:00
"Phool Bagh, Gwalior, India",83,83.0,38.0,,1.5,6.4,8.9,26.210536,78.171,2024-04-21 21:00:00
"Marhatal, Jabalpur, India",164,164.0,134.0,0.5,44.9,8.6,59.0,23.168606,79.932247,2024-04-21 21:00:00
"Shasthri Nagar, Ratlam, India",160,160.0,101.0,,11.6,16.3,,23.331731,75.045981,2024-04-21 21:00:00
"Deen Dayal Nagar, Sagar, India",14,33.0,14.0,,8.7,3.2,11.4,23.8640158,78.80289321,2024-04-21 21:00:00
"Bandhavgar Colony, Satna, India",-,95.0,82.0,3.3,17.3,1.5,9.8,24.58434363,80.8549414,2024-04-21 07:00:00
"Mahakaleshwar Temple, Ujjain, India",-,57.0,61.0,50.4,7.6,4.9,5.7,23.182719,75.768218,2024-04-20 22:00:00
